{
  "case_id": "ZG-CB-XX-YYYY-NN",
  "country": "Country Name",
  "culture_region": "Kulturraum / Region",
  "timeframe": { 
    "from": "YYYY", 
    "to": "YYYY", 
    "note": "Optional: Anmerkungen zum Zeitrahmen" 
  },
  "context_type": "interview",
  "source": {
    "medium": "Medium (z. B. Video, Audio, Text)",
    "title_or_label": "Titel oder Beschreibung der Quelle",
    "creator_or_channel": "Ersteller oder Kanal (optional)",
    "published_at": "YYYY-MM-DD",
    "url": "",
    "notes": "Optionale Quellenangaben ergänzen"
  },
  "linked_modules": ["ZG-XXX-module-name", "FM-XXX-module-name"],
  "description": {
    "descriptive": "Deskriptive Beschreibung des Falls ohne Wertungen. Was passiert? Wer ist beteiligt? Welche Kontexte sind relevant?",
    "keywords": ["Schlüsselwort1", "Schlüsselwort2", "Schlüsselwort3"]
  },
  "fracture_points": [
    "Beschreibung eines Bruchpunkts 1",
    "Beschreibung eines Bruchpunkts 2",
    "Beschreibung eines Bruchpunkts 3"
  ],
  "reaction_patterns": {
    "individual": ["Individuelle Reaktion 1", "Individuelle Reaktion 2"],
    "social": ["Soziale Reaktion 1", "Soziale Reaktion 2"],
    "ideological_or_spiritual": ["Ideologisch/spirituelle Reaktion 1", "Ideologisch/spirituelle Reaktion 2"]
  },
  "structure_themes": {
    "order_powerlessness": ["Beobachtung zu Ordnung/Ohnmacht 1", "Beobachtung zu Ordnung/Ohnmacht 2"],
    "bonding_unbonding": ["Beobachtung zu Bindung/Entbindung 1", "Beobachtung zu Bindung/Entbindung 2"],
    "meaning_substitute": ["Beobachtung zu Sinn/Ersatz 1", "Beobachtung zu Sinn/Ersatz 2"],
    "memory_forgetting": ["Beobachtung zu Gedächtnis/Vergessen 1", "Beobachtung zu Gedächtnis/Vergessen 2"]
  },
  "anthropological_constants": {
    "family": ["Familienbezogene Beobachtung"],
    "faith": ["Glaube/Transzendenz-bezogene Beobachtung"],
    "transition_initiation": ["Übergang-bezogene Beobachtung"],
    "generation": ["Generationen-bezogene Beobachtung"],
    "ritual": ["Ritual-bezogene Beobachtung"]
  },
  "perspective_openness": {
    "alternative_interpretations": ["Mögliche alternative Deutung 1", "Mögliche alternative Deutung 2"],
    "culture_specific_notes": ["Kulturspezifischer Kontext für andere Länder"]
  },
  "status": "raw",
  "created_at": "YYYY-MM-DD",
  "created_by": "Menschenname (optional)"
}
